{
  "$schema": "https://json-schema.org/draft/2020-12/schema",
  "type": "object",
  "additionalProperties": false,
  "required": ["complete", "school_name", "town_name", "boards", "warnings"],
  "properties": {
    "complete": { "type": "boolean" },
    "school_name": { "type": "string" },
    "town_name": { "type": "string" },
    "boards": {
      "type": "array",
      "minItems": 7,
      "maxItems": 7,
      "items": { "$ref": "#/$defs/board" }
    },
    "warnings": { "type": "array", "items": { "type": "string" } }
  },
  "$defs": {
    "board": {
      "type": "object",
      "additionalProperties": false,
      "required": ["complete", "school_name", "town_name", "template_id", "title", "description", "icon", "cards", "warnings"],
      "properties": {
        "complete": { "type": "boolean" },
        "school_name": { "type": "string" },
        "town_name": { "type": "string" },
        "template_id": { "type": "string" },
        "title": { "type": "string" },
        "description": { "type": "string" },
        "icon": { "type": "string" },
        "cards": {
          "type": "array",
          "minItems": 10,
          "maxItems": 10,
          "items": { "$ref": "#/$defs/card" }
        },
        "warnings": { "type": "array", "items": { "type": "string" } }
      }
    },
    "card": {
      "type": "object",
      "additionalProperties": false,
      "required": ["subject_id", "subject_type", "entity_name", "title", "subtitle", "notes", "short_summary", "evidence_claim", "source_url", "source_title", "source_kind", "source_published_at", "source_fetched_at", "latitude", "longitude", "maps_url", "access_notes", "cost_status", "under21_safe"],
      "properties": {
        "subject_id": { "type": "string" },
        "subject_type": { "enum": ["place", "tradition", "activity", "study_space", "street_or_district", "sequence_stop"] },
        "entity_name": { "type": "string" },
        "title": { "type": "string" },
        "subtitle": { "type": "string" },
        "notes": { "type": "string" },
        "short_summary": { "type": "string" },
        "evidence_claim": { "type": "string" },
        "source_url": { "type": "string" },
        "source_title": { "type": "string" },
        "source_kind": { "enum": ["university_official", "business_official", "government", "student_media", "local_media", "cultural_institution", "other_reliable"] },
        "source_published_at": { "type": ["string", "null"] },
        "source_fetched_at": { "type": "string" },
        "latitude": { "type": ["number", "null"] },
        "longitude": { "type": ["number", "null"] },
        "maps_url": { "type": ["string", "null"] },
        "access_notes": { "type": "string" },
        "cost_status": { "enum": ["free", "purchase_required", "unknown", "not_applicable"] },
        "under21_safe": { "type": "boolean" }
      }
    }
  }
}
