{"complete":true,"school_name":"Marywood University","town_name":"Scranton","boards":[{"complete":true,"school_name":"Marywood University","town_name":"Scranton","template_id":"college-late-night-runs","title":"10 Late-Night Runs That Explain Marywood University","description":"Ten under-21-safe food destinations with currently published late availability in Scranton.","icon":"nightlife","cards":[{"subject_id":"marywood-main-dining-room","subject_type":"place","entity_name":"Main Dining Room","title":"Main Dining Room","subtitle":"Marywood University, 2300 Adams Avenue","notes":"Use the on-campus late-night station Sunday through Thursday; confirm dining eligibility and payment option before heading over.","short_summary":"A campus dining option whose published schedule includes a dedicated late-night service period.","evidence_claim":"Marywood lists Main Dining Room late-night service Sunday–Thursday from 8:00 p.m. to 11:00 p.m.","source_url":"https://www.marywood.edu/places/main-dining-room","source_title":"Main Dining Room | Marywood University","source_kind":"university_official","source_published_at":null,"source_fetched_at":"2026-08-13","latitude":null,"longitude":null,"maps_url":null,"access_notes":"Published late-night service is Sunday–Thursday, 8:00–11:00 p.m.; meal swipes and other payment forms are listed.","cost_status":"purchase_required","under21_safe":true},{"subject_id":"dennys-scranton-carbondale-highway","subject_type":"place","entity_name":"Denny's","title":"Denny's on Scranton Carbondale Highway","subtitle":"410 Scranton Carbondale Highway, Scranton","notes":"A 24-hour diner option for a sit-down meal or takeout; check the live ordering cutoff before leaving campus.","short_summary":"The published location schedule runs essentially all day and night.","evidence_claim":"Denny's lists this Scranton location's store hours as 12:00 a.m.–11:58 p.m. every day and describes it as open 24/7.","source_url":"https://dennys.com/location/-395661","source_title":"Denny's Scranton location","source_kind":"business_official","source_published_at":null,"source_fetched_at":"2026-08-13","latitude":null,"longitude":null,"maps_url":null,"access_notes":"Published store hours are 12:00 a.m.–11:58 p.m. daily; online-order acceptance can have a separate cutoff.","cost_status":"purchase_required","under21_safe":true},{"subject_id":"taco-bell-2-olive-st","subject_type":"place","entity_name":"Taco Bell — 2 Olive Street","title":"Taco Bell on Olive Street","subtitle":"2 Olive Street, Scranton","notes":"Plan for drive-thru or delivery after the dining room closes; the official listing publishes later drive-thru hours.","short_summary":"A Scranton Taco Bell with a consistently late drive-thru schedule.","evidence_claim":"Taco Bell lists the 2 Olive Street drive-thru as open until 2:00 a.m. every day.","source_url":"https://locations.tacobell.com/pa/scranton/2-olive-st.html","source_title":"Taco Bell — 2 Olive Street, Scranton","source_kind":"business_official","source_published_at":null,"source_fetched_at":"2026-08-13","latitude":null,"longitude":null,"maps_url":null,"access_notes":"Drive-thru is published until 2:00 a.m. daily; the dining room has earlier hours.","cost_status":"purchase_required","under21_safe":true},{"subject_id":"taco-bell-733-davis-st","subject_type":"place","entity_name":"Taco Bell — 733 Davis Street","title":"Taco Bell on Davis Street","subtitle":"733 Davis Street, Scranton","notes":"Use the drive-thru for the latest service, and check the day because published closing times differ on weekends.","short_summary":"A second Scranton Taco Bell with late drive-thru availability.","evidence_claim":"Taco Bell lists the 733 Davis Street drive-thru until 1:00 a.m. Sunday–Thursday and 2:00 a.m. Friday–Saturday.","source_url":"https://locations.tacobell.com/pa/scranton/733-davis-st.html","source_title":"Taco Bell — 733 Davis Street, Scranton","source_kind":"business_official","source_published_at":null,"source_fetched_at":"2026-08-13","latitude":null,"longitude":null,"maps_url":null,"access_notes":"Published drive-thru hours end at 1:00 a.m. Sunday–Thursday and 2:00 a.m. Friday–Saturday; dine-in ends earlier.","cost_status":"purchase_required","under21_safe":true},{"subject_id":"shams-hot-chicken-scranton","subject_type":"place","entity_name":"Shams Hot Chicken — Scranton","title":"Shams Hot Chicken","subtitle":"1657 North Keyser Avenue, Scranton","notes":"Order a halal meal for pickup before midnight Sunday through Friday; Saturday's published closing time is earlier.","short_summary":"A local halal-food option with late weekday and Sunday hours.","evidence_claim":"Shams Hot Chicken lists its Scranton location as open until 12:00 a.m. Sunday–Friday and until 11:00 p.m. Saturday.","source_url":"https://www.shamshotchicken.com/","source_title":"Shams Hot Chicken","source_kind":"business_official","source_published_at":null,"source_fetched_at":"2026-08-13","latitude":null,"longitude":null,"maps_url":null,"access_notes":"Published Scranton hours: 11:00 a.m.–12:00 a.m. Sunday–Friday and 12:00 p.m.–11:00 p.m. Saturday; holidays may vary.","cost_status":"purchase_required","under21_safe":true},{"subject_id":"joes-kwik-mart-166","subject_type":"place","entity_name":"Joe's Kwik Mart #166","title":"Joe's Kwik Mart on North Keyser","subtitle":"701 North Keyser Avenue, Scranton","notes":"Use this convenience stop for hot food or packaged snacks when restaurant kitchens are closed; indoor seating is listed.","short_summary":"A 24-hour convenience store that explicitly lists hot food among its amenities.","evidence_claim":"Joe's Kwik Mart lists its #166 Scranton location as open 24 hours daily and identifies hot food as an amenity.","source_url":"https://joeskwikmart.com/locations/joes-kwik-mart-166","source_title":"Joe's Kwik Mart #166","source_kind":"business_official","source_published_at":null,"source_fetched_at":"2026-08-13","latitude":null,"longitude":null,"maps_url":null,"access_notes":"Published as open 24 hours daily; the location lists hot food and indoor seating.","cost_status":"purchase_required","under21_safe":true},{"subject_id":"cks-pizza","subject_type":"place","entity_name":"CK's Pizza","title":"CK's Pizza","subtitle":"1201 Mulberry Street, Scranton","notes":"Place a takeout order before midnight Monday through Saturday; this pizzeria's official page lists no Sunday service.","short_summary":"A Mulberry Street pizzeria with a published midnight closing time on operating days.","evidence_claim":"CK's Pizza lists hours of 4:00 p.m.–12:00 a.m. Monday through Saturday.","source_url":"https://ckspizza.com/menu","source_title":"CK's Pizza menu and contact page","source_kind":"business_official","source_published_at":null,"source_fetched_at":"2026-08-13","latitude":null,"longitude":null,"maps_url":null,"access_notes":"Published hours are Monday–Saturday, 4:00 p.m.–12:00 a.m.; no Sunday hours are listed.","cost_status":"purchase_required","under21_safe":true},{"subject_id":"scranton-pizzeria","subject_type":"place","entity_name":"Scranton Pizzeria","title":"Scranton Pizzeria","subtitle":"1225 Mulberry Street, Scranton","notes":"Use online ordering or pickup before the published 10:30 p.m. closing time; verify that day's full-hours listing first.","short_summary":"A named pizza shop whose own ordering page posts a 10:30 p.m. close.","evidence_claim":"Scranton Pizzeria's ordering page lists its hours as 11:00 a.m.–10:30 p.m.","source_url":"https://www.scrantonpizzeria.com/","source_title":"Scranton Pizzeria","source_kind":"business_official","source_published_at":null,"source_fetched_at":"2026-08-13","latitude":null,"longitude":null,"maps_url":null,"access_notes":"The official ordering page displays 11:00 a.m.–10:30 p.m.; review the current full-hours link before travel.","cost_status":"purchase_required","under21_safe":true},{"subject_id":"wendys-703-davis-st","subject_type":"place","entity_name":"Wendy's — 703 Davis Street","title":"Wendy's on Davis Street","subtitle":"703 Davis Street, Scranton","notes":"Check the location page for the day-specific schedule before going; the official city listing shows a midnight closing time.","short_summary":"A Davis Street fast-food location with a published midnight close on one weekly schedule entry.","evidence_claim":"Wendy's official Scranton locator lists the 703 Davis Street restaurant and shows an 'Open Until 12:00 AM' schedule entry.","source_url":"https://locations.wendys.com/united-states/pa/scranton","source_title":"Wendy's locations in Scranton, Pennsylvania","source_kind":"business_official","source_published_at":null,"source_fetched_at":"2026-08-13","latitude":null,"longitude":null,"maps_url":null,"access_notes":"The official city locator displays an 'Open Until 12:00 AM' entry; confirm the specific day and service mode before travel.","cost_status":"purchase_required","under21_safe":true},{"subject_id":"wendys-944-wyoming-ave","subject_type":"place","entity_name":"Wendy's — 944 Wyoming Avenue","title":"Wendy's on Wyoming Avenue","subtitle":"944 Wyoming Avenue, Scranton","notes":"Use the official locator to confirm the day-specific hours and service mode; it posts a midnight closing-time entry.","short_summary":"A separate Wyoming Avenue location with a published late closing schedule entry.","evidence_claim":"Wendy's official Scranton locator lists the 944 Wyoming Avenue restaurant and shows an 'Open Until 12:00 AM' schedule entry.","source_url":"https://locations.wendys.com/united-states/pa/scranton","source_title":"Wendy's locations in Scranton, Pennsylvania","source_kind":"business_official","source_published_at":null,"source_fetched_at":"2026-08-13","latitude":null,"longitude":null,"maps_url":null,"access_notes":"The official city locator displays an 'Open Until 12:00 AM' entry; confirm the specific day and service mode before travel.","cost_status":"purchase_required","under21_safe":true}],"warnings":[]}],"warnings":[]}