{"complete":true,"school_name":"California Institute of Technology","town_name":"Pasadena","boards":[{"complete":true,"school_name":"California Institute of Technology","town_name":"Pasadena","template_id":"college-blocks-off-campus","title":"10 Blocks Off Campus, One Reason Each","description":"Ten named Pasadena destinations on distinct nearby corridors, each with a source-backed reason to stop.","icon":"location_city","cards":[{"subject_id":"pasadena-playhouse-el-molino","subject_type":"street_or_district","entity_name":"Pasadena Playhouse","title":"Pasadena Playhouse","subtitle":"S. El Molino Avenue corridor","notes":"Check the current performance calendar, then use the box office at the historic theater on South El Molino Avenue.","short_summary":"A historic theater stop on the El Molino corridor.","evidence_claim":"Pasadena Playhouse is located at 39 S. El Molino Avenue and includes a 643-seat historic theater.","source_url":"https://www.pasadenaplayhouse.org/centennial/","source_title":"Playhouse 100","source_kind":"cultural_institution","source_published_at":null,"source_fetched_at":"2026-08-13","latitude":null,"longitude":null,"maps_url":null,"access_notes":"Performances and ticket availability vary; consult the Playhouse calendar or box office before visiting.","cost_status":"purchase_required","under21_safe":true},{"subject_id":"playhouse-village-park-union","subject_type":"street_or_district","entity_name":"Playhouse Village Park","title":"Playhouse Village Park","subtitle":"E. Union Street corridor","notes":"Use the paths and open grass area for a daytime pause; the city lists restrooms and a drinking fountain on site.","short_summary":"A city park with paths, open space, and practical amenities.","evidence_claim":"Playhouse Village Park at 701 E. Union Street has open grass, paths, a playground, dog areas, restrooms, and drinking fountains.","source_url":"https://www.cityofpasadena.net/parks-and-rec/parks/playhouse-village-park/","source_title":"Playhouse Village Park","source_kind":"government","source_published_at":null,"source_fetched_at":"2026-08-13","latitude":null,"longitude":null,"maps_url":null,"access_notes":"City-listed park hours are daily, 6:00 a.m.–10:00 p.m.","cost_status":"unknown","under21_safe":true},{"subject_id":"usc-pacific-asia-museum-los-robles","subject_type":"street_or_district","entity_name":"USC Pacific Asia Museum","title":"USC Pacific Asia Museum","subtitle":"N. Los Robles Avenue corridor","notes":"Plan a gallery visit around the Wednesday–Sunday schedule, or choose a second Sunday when the museum lists free admission.","short_summary":"Asian and Pacific arts museum on North Los Robles.","evidence_claim":"USC Pacific Asia Museum is at 46 N. Los Robles Avenue, is open Wednesday–Sunday, and lists free admission every second Sunday.","source_url":"https://pacificasiamuseum.usc.edu/visit-us/","source_title":"Visit Us — USC Pacific Asia Museum","source_kind":"cultural_institution","source_published_at":null,"source_fetched_at":"2026-08-13","latitude":null,"longitude":null,"maps_url":null,"access_notes":"Regular admission applies except listed free-admission periods; hours are Wednesday–Sunday, 11 a.m.–5 p.m.","cost_status":"purchase_required","under21_safe":true},{"subject_id":"pasadena-convention-center-green","subject_type":"street_or_district","entity_name":"Pasadena Convention Center","title":"Pasadena Convention Center","subtitle":"E. Green Street corridor","notes":"Look up the public event calendar before heading to the campus; the official directions identify the Civic Auditorium at this address.","short_summary":"A Green Street event campus anchored by the Civic Auditorium.","evidence_claim":"The Pasadena Convention Center is at 300 E. Green Street, and official directions place Pasadena Civic Auditorium at that address.","source_url":"https://www.visitpasadena.com/convention-center/attendees/directions-parking/","source_title":"Parking & Directions to the Pasadena Convention Center","source_kind":"business_official","source_published_at":null,"source_fetched_at":"2026-08-13","latitude":null,"longitude":null,"maps_url":null,"access_notes":"Entry and cost depend on the specific scheduled event.","cost_status":"unknown","under21_safe":true},{"subject_id":"norton-simon-museum-colorado","subject_type":"street_or_district","entity_name":"Norton Simon Museum","title":"Norton Simon Museum","subtitle":"W. Colorado Boulevard corridor","notes":"Set aside time for the galleries and sculpture garden; students with ID and visitors 18 and under are listed for free admission.","short_summary":"An art-museum stop at Colorado and Orange Grove.","evidence_claim":"Norton Simon Museum is at 411 W. Colorado Boulevard; admission is free for students with ID and everyone age 18 and under.","source_url":"https://www.nortonsimon.org/","source_title":"Norton Simon Museum — Plan Your Visit","source_kind":"cultural_institution","source_published_at":null,"source_fetched_at":"2026-08-13","latitude":null,"longitude":null,"maps_url":null,"access_notes":"The museum lists hours Sunday, Monday, Thursday 12–5 p.m. and Friday–Saturday 12–7 p.m.; it is closed Tuesday and Wednesday.","cost_status":"unknown","under21_safe":true},{"subject_id":"gamble-house-westmoreland","subject_type":"street_or_district","entity_name":"The Gamble House","title":"The Gamble House","subtitle":"Westmoreland Place corridor","notes":"Walk by the house and gardens, then reserve ahead if you want the guided interior tour rather than an exterior visit.","short_summary":"A preserved house museum on Westmoreland Place.","evidence_claim":"The Gamble House is at 4 Westmoreland Place; visitors may explore its exterior and gardens, while house visits are by tour.","source_url":"https://gamblehouse.org/visit/","source_title":"Visit — The Gamble House","source_kind":"cultural_institution","source_published_at":null,"source_fetched_at":"2026-08-13","latitude":null,"longitude":null,"maps_url":null,"access_notes":"Tours run Tuesday and Thursday–Sunday; advance ticketing is recommended.","cost_status":"purchase_required","under21_safe":true},{"subject_id":"kidspace-arroyo","subject_type":"street_or_district","entity_name":"Kidspace Children's Museum","title":"Kidspace Children's Museum","subtitle":"N. Arroyo Boulevard corridor","notes":"Bring younger relatives for the outdoor campus and check the daily exhibit availability before purchasing admission.","short_summary":"A hands-on children’s museum on North Arroyo Boulevard.","evidence_claim":"Kidspace Children’s Museum is at 480 N. Arroyo Boulevard and describes its site as a 3.5-acre outdoor campus.","source_url":"https://kidspacemuseum.org/visit/hours-and-admission/","source_title":"Hours & Admission — Kidspace Children's Museum","source_kind":"cultural_institution","source_published_at":null,"source_fetched_at":"2026-08-13","latitude":null,"longitude":null,"maps_url":null,"access_notes":"The museum lists daily hours of 10 a.m.–5 p.m.; paid admission is generally required.","cost_status":"purchase_required","under21_safe":true},{"subject_id":"rose-bowl-stadium-drive","subject_type":"street_or_district","entity_name":"Rose Bowl Stadium","title":"Rose Bowl Stadium","subtitle":"Rose Bowl Drive corridor","notes":"Check the stadium’s tour or event schedule before making the trip to the landmark venue on Rose Bowl Drive.","short_summary":"A National Historic Landmark stadium destination.","evidence_claim":"Rose Bowl Stadium is at 1001 Rose Bowl Drive and is recognized as a National Historic Landmark.","source_url":"https://www.rosebowlstadium.com/tours/contact-us","source_title":"Contact Rose Bowl Stadium Tours","source_kind":"business_official","source_published_at":null,"source_fetched_at":"2026-08-13","latitude":null,"longitude":null,"maps_url":null,"access_notes":"Tour and event access depend on the current schedule and ticketing.","cost_status":"unknown","under21_safe":true},{"subject_id":"arlington-garden-arlington","subject_type":"street_or_district","entity_name":"Arlington Garden","title":"Arlington Garden","subtitle":"Arlington Drive corridor","notes":"Take the marked paths through the public garden in daylight, and leave flowers, fruit, and planted areas undisturbed.","short_summary":"A free public garden for a quiet daylight walk.","evidence_claim":"Arlington Garden is a three-acre public garden, open seven days a week during daylight hours and free to the public.","source_url":"https://www.arlingtongardenpasadena.org/about/","source_title":"What is Arlington Garden?","source_kind":"cultural_institution","source_published_at":null,"source_fetched_at":"2026-08-13","latitude":null,"longitude":null,"maps_url":null,"access_notes":"Open during daylight hours and closed after dark; follow the garden’s posted etiquette and stay on marked paths.","cost_status":"free","under21_safe":true},{"subject_id":"pasadena-city-college-colorado","subject_type":"street_or_district","entity_name":"Pasadena City College Colorado Campus","title":"Pasadena City College Colorado Campus","subtitle":"E. Colorado Boulevard corridor","notes":"Use the public campus map to locate a scheduled arts, athletics, or community event before heading east on Colorado Boulevard.","short_summary":"A map-listed college campus with public event venues.","evidence_claim":"Pasadena City College's Colorado Campus is at 1570 E. Colorado Boulevard and lists public event venues including its theater, auditorium, observatory, and gallery.","source_url":"https://www.pasadena.edu/about/our-campuses.php","source_title":"Our Sites — Pasadena City College","source_kind":"university_official","source_published_at":"2026-07-28","source_fetched_at":"2026-08-13","latitude":null,"longitude":null,"maps_url":null,"access_notes":"Campus facilities and event access vary; consult the college’s current calendar and campus map.","cost_status":"unknown","under21_safe":true}],"warnings":[]}],"warnings":[]}