{"complete":true,"school_name":"Rhode Island School of Design","town_name":"Providence","boards":[{"complete":true,"school_name":"Rhode Island School of Design","town_name":"Providence","template_id":"college-first-weekend","title":"Your First Weekend at Rhode Island School of Design, Shared as Cards","description":"A low-key, under-21-safe sequence for getting oriented through RISD’s documented campus spaces, collections and student exhibitions.","icon":"schedule","cards":[{"subject_id":"risd-beach","subject_type":"sequence_stop","entity_name":"RISD Beach","title":"Start with a campus-landmark pause","subtitle":"RISD Beach · Benefit Street","notes":"Begin by locating the lawn between Waterman and Angell streets; use it as a simple outdoor checkpoint before exploring nearby buildings.","short_summary":"A named campus lawn for an easy first orientation stop.","evidence_claim":"RISD identifies RISD Beach as the grass on Benefit Street between Waterman and Angell streets.","source_url":"https://www.risd.edu/about/visiting-campus","source_title":"Visiting RISD Campus","source_kind":"university_official","source_published_at":null,"source_fetched_at":"2026-08-13","latitude":null,"longitude":null,"maps_url":null,"access_notes":"Outdoor campus location; follow posted campus guidance.","cost_status":"free","under21_safe":true},{"subject_id":"risd-campus-map","subject_type":"sequence_stop","entity_name":"RISD Campus Map","title":"Get the campus layout in hand","subtitle":"RISD campus · Providence","notes":"Open the official map before choosing a route. It labels buildings, outdoor spaces, dining sites, galleries and key services across campus.","short_summary":"An official map anchors the rest of the weekend route.","evidence_claim":"RISD directs visitors to its online campus map for specific buildings and offices.","source_url":"https://www.risd.edu/about/visiting-campus","source_title":"Visiting RISD Campus","source_kind":"university_official","source_published_at":null,"source_fetched_at":"2026-08-13","latitude":null,"longitude":null,"maps_url":null,"access_notes":"Available online; use the current map before traveling between sites.","cost_status":"free","under21_safe":true},{"subject_id":"fleet-library-risd","subject_type":"sequence_stop","entity_name":"Fleet Library at RISD","title":"Browse the art-and-design stacks","subtitle":"Roger Mandle Building · 15 Westminster Street","notes":"Set aside time to see the circulating collection, artists’ books and Materials Resource Center; confirm entry and borrowing rules at the desk.","short_summary":"A documented campus library with extensive art and design resources.","evidence_claim":"RISD says Fleet Library has a circulating collection of more than 150,000 books and includes a Materials Resource Center and artists’ books.","source_url":"https://www.risd.edu/academics/campus-resources/fleet-library-risd","source_title":"Fleet Library at RISD","source_kind":"university_official","source_published_at":null,"source_fetched_at":"2026-08-13","latitude":null,"longitude":null,"maps_url":null,"access_notes":"Check current library access and service hours before visiting.","cost_status":"free","under21_safe":true},{"subject_id":"edna-w-lawrence-nature-lab","subject_type":"sequence_stop","entity_name":"Edna W. Lawrence Nature Lab","title":"Look closely at the Nature Lab","subtitle":"Waterman Building · 13 Waterman Street","notes":"Visit with a specific visual question in mind, then ask staff about current access to the preserved-specimen collection and microscopy resources.","short_summary":"A RISD resource linking art, design and natural science.","evidence_claim":"RISD describes the Nature Lab as holding more than 80,000 preserved natural-science specimens plus microscopy and micro-imaging systems.","source_url":"https://www.risd.edu/about/directory/edna-w-lawrence-nature-lab","source_title":"Edna W. Lawrence Nature Lab","source_kind":"university_official","source_published_at":null,"source_fetched_at":"2026-08-13","latitude":null,"longitude":null,"maps_url":null,"access_notes":"Confirm current hours and access procedures with the Nature Lab.","cost_status":"free","under21_safe":true},{"subject_id":"risd-museum","subject_type":"sequence_stop","entity_name":"RISD Museum","title":"Make time for the museum collection","subtitle":"20 North Main Street / 224 Benefit Street","notes":"Choose a gallery or two rather than rushing the whole museum. Bring your RISD ID and check the museum’s current visitor information first.","short_summary":"A museum stop with free admission for RISD students carrying valid ID.","evidence_claim":"The RISD Museum states that RISD students receive free admission with valid college ID.","source_url":"https://risdmuseum.org/hours-admission","source_title":"Hours & Admission | RISD Museum","source_kind":"cultural_institution","source_published_at":null,"source_fetched_at":"2026-08-13","latitude":null,"longitude":null,"maps_url":null,"access_notes":"Current hours list Tue–Sun service; review closures and ticket guidance before arrival.","cost_status":"free","under21_safe":true},{"subject_id":"gelman-student-exhibitions-gallery","subject_type":"sequence_stop","entity_name":"Gelman Student Exhibitions Gallery","title":"See a current student exhibition","subtitle":"Chace Center, 2nd floor · 20 North Main Street","notes":"Check the current exhibition dates, then spend time with the show’s labels and installation. The gallery is a direct view of student-curated work.","short_summary":"A public-facing RISD gallery for student work and curatorial projects.","evidence_claim":"RISD says the Gelman Student Exhibitions Gallery is accessible to museum visitors and the general public and offers student exhibition experience.","source_url":"https://www.risd.edu/academics/campus-resources/gelman-student-exhibitions-gallery","source_title":"Gelman Student Exhibitions Gallery","source_kind":"university_official","source_published_at":null,"source_fetched_at":"2026-08-13","latitude":null,"longitude":null,"maps_url":null,"access_notes":"The official page lists Tues–Sun, 10 am–5 pm; confirm exhibition availability before going.","cost_status":"free","under21_safe":true},{"subject_id":"market-square-risd","subject_type":"sequence_stop","entity_name":"Market Square","title":"Add Market Square to your bearings","subtitle":"Market Square · RISD campus","notes":"Use this map-listed campus space as a waypoint while connecting the downtown-facing buildings to the rest of the RISD route.","short_summary":"A named key space on RISD’s official campus map.","evidence_claim":"RISD’s campus map lists Market Square among its key spaces.","source_url":"https://www.risd.edu/sites/default/files/2025-09/risd-campus-map-directory-2025.pdf","source_title":"RISD Campus Map Directory","source_kind":"university_official","source_published_at":null,"source_fetched_at":"2026-08-13","latitude":null,"longitude":null,"maps_url":null,"access_notes":"Outdoor/shared campus space; observe any event setup or posted restrictions.","cost_status":"free","under21_safe":true},{"subject_id":"farnum-park","subject_type":"sequence_stop","entity_name":"Farnum Park","title":"Take a short outdoor reset","subtitle":"Farnum Park · RISD campus","notes":"Build in a brief stop at this named outdoor space, then use the campus map to decide whether to continue toward studios or downtown.","short_summary":"A map-listed RISD outdoor space for a route break.","evidence_claim":"RISD’s campus map directory identifies Farnum Park as an outdoor space.","source_url":"https://www.risd.edu/sites/default/files/2025-09/risd-campus-map-directory-2025.pdf","source_title":"RISD Campus Map Directory","source_kind":"university_official","source_published_at":null,"source_fetched_at":"2026-08-13","latitude":null,"longitude":null,"maps_url":null,"access_notes":"Outdoor space; check conditions and posted campus information.","cost_status":"free","under21_safe":true},{"subject_id":"frazier-terrace","subject_type":"sequence_stop","entity_name":"Frazier Terrace","title":"Trace another named outdoor space","subtitle":"Frazier Terrace · RISD campus","notes":"Use Frazier Terrace as a quiet map-reading stop. It helps turn a first walk through campus into a route you can repeat independently.","short_summary":"A documented outdoor waypoint on the RISD campus map.","evidence_claim":"RISD’s campus map directory identifies Frazier Terrace as an outdoor space.","source_url":"https://www.risd.edu/sites/default/files/2025-09/risd-campus-map-directory-2025.pdf","source_title":"RISD Campus Map Directory","source_kind":"university_official","source_published_at":null,"source_fetched_at":"2026-08-13","latitude":null,"longitude":null,"maps_url":null,"access_notes":"Outdoor space; follow campus signage and any temporary restrictions.","cost_status":"free","under21_safe":true},{"subject_id":"metcalf-refectory-patio","subject_type":"sequence_stop","entity_name":"Metcalf Refectory Patio","title":"End near a map-listed patio","subtitle":"Metcalf Refectory Patio · RISD campus","notes":"Finish your walk by locating this named patio near the Refectory, then review the dining information separately if you plan to purchase food.","short_summary":"A named patio that closes the route near a campus dining building.","evidence_claim":"RISD’s campus map directory lists the Metcalf Refectory Patio among its outdoor spaces.","source_url":"https://www.risd.edu/sites/default/files/2025-09/risd-campus-map-directory-2025.pdf","source_title":"RISD Campus Map Directory","source_kind":"university_official","source_published_at":null,"source_fetched_at":"2026-08-13","latitude":null,"longitude":null,"maps_url":null,"access_notes":"Outdoor patio location; dining purchases, if any, are separate.","cost_status":"free","under21_safe":true}],"warnings":[]}],"warnings":[]}