{"complete":true,"school_name":"Northeastern University","town_name":"Boston","boards":[{"complete":true,"school_name":"Northeastern University","town_name":"Boston","template_id":"college-blocks-off-campus","title":"10 Blocks Off Campus, One Reason Each","description":"Ten named, publicly documented destinations along the Huntington, Massachusetts Avenue, Boylston, and Fenway corridors near Northeastern.","icon":"location_city","cards":[{"subject_id":"symphony-hall-massachusetts-avenue","subject_type":"street_or_district","entity_name":"Symphony Hall","title":"Symphony Hall","subtitle":"Massachusetts Avenue corridor","notes":"Walk the Massachusetts Avenue corridor to see the National Historic Landmark and check the BSO calendar before planning a concert visit.","short_summary":"A historic concert hall at 301 Massachusetts Avenue.","evidence_claim":"BSO identifies Symphony Hall at 301 Massachusetts Avenue as the home of the Boston Symphony Orchestra and Boston Pops.","source_url":"https://www.bso.org/symphony-hall/about","source_title":"BSO | About Symphony Hall","source_kind":"cultural_institution","source_published_at":null,"source_fetched_at":"2026-08-13","latitude":null,"longitude":null,"maps_url":null,"access_notes":"Concert entry and ticketing vary by event; review the BSO event calendar and venue guidance before visiting.","cost_status":"purchase_required","under21_safe":true},{"subject_id":"jordan-hall-gainsborough-street","subject_type":"street_or_district","entity_name":"Jordan Hall","title":"Jordan Hall","subtitle":"Gainsborough Street corridor","notes":"Use Gainsborough Street to locate NEC’s Jordan Hall, then consult the conservatory’s performance listings for public programs.","short_summary":"New England Conservatory’s landmark performance venue.","evidence_claim":"New England Conservatory lists Jordan Hall at 30 Gainsborough Street and presents performances there.","source_url":"https://necmusic.edu/jordan-hall/","source_title":"Jordan Hall | New England Conservatory","source_kind":"university_official","source_published_at":null,"source_fetched_at":"2026-08-13","latitude":null,"longitude":null,"maps_url":null,"access_notes":"Performance admission and building access depend on the scheduled event; confirm details with NEC.","cost_status":"purchase_required","under21_safe":true},{"subject_id":"huntington-theatre-huntington-avenue","subject_type":"street_or_district","entity_name":"Huntington Theatre","title":"Huntington Theatre","subtitle":"Huntington Avenue corridor","notes":"Follow Huntington Avenue to the theatre’s 264 address and use its season page to choose a production or community event.","short_summary":"A producing theatre on Huntington Avenue.","evidence_claim":"Huntington Theatre lists its venue at 264 Huntington Avenue in Boston.","source_url":"https://www.huntingtontheatre.org/plan-your-visit/","source_title":"Plan Your Visit | Huntington Theatre","source_kind":"cultural_institution","source_published_at":null,"source_fetched_at":"2026-08-13","latitude":null,"longitude":null,"maps_url":null,"access_notes":"Tickets, event times, and accessibility arrangements vary by production; consult the theatre’s visit information.","cost_status":"purchase_required","under21_safe":true},{"subject_id":"museum-of-fine-arts-huntington-avenue","subject_type":"street_or_district","entity_name":"Museum of Fine Arts, Boston","title":"Museum of Fine Arts, Boston","subtitle":"Huntington Avenue corridor","notes":"Continue along Huntington Avenue to the MFA’s main entrance and reserve timed admission before heading into the galleries.","short_summary":"A major art museum with its main entrance on Huntington Avenue.","evidence_claim":"The MFA lists its main entrance at 465 Huntington Avenue and asks visitors to arrive with tickets purchased in advance.","source_url":"https://www.mfa.org/visit/getting-here","source_title":"Getting Here | Museum of Fine Arts Boston","source_kind":"cultural_institution","source_published_at":null,"source_fetched_at":"2026-08-13","latitude":null,"longitude":null,"maps_url":null,"access_notes":"The Huntington Avenue Entrance is the main entrance; timed admission is recommended and ticketed.","cost_status":"purchase_required","under21_safe":true},{"subject_id":"isabella-stewart-gardner-museum-evans-way","subject_type":"street_or_district","entity_name":"Isabella Stewart Gardner Museum","title":"Isabella Stewart Gardner Museum","subtitle":"Evans Way corridor","notes":"Take the Evans Way corridor to the museum entrance at 25 Evans Way and reserve a timed ticket for the galleries.","short_summary":"An art museum founded by Isabella Stewart Gardner.","evidence_claim":"The Gardner Museum lists its address as 25 Evans Way and states that advance ticketing is recommended.","source_url":"https://www.gardnermuseum.org/visit","source_title":"Prepare for Your Visit | Isabella Stewart Gardner Museum","source_kind":"cultural_institution","source_published_at":null,"source_fetched_at":"2026-08-13","latitude":null,"longitude":null,"maps_url":null,"access_notes":"Timed tickets are recommended; current museum hours include Thursday evening hours until 9 p.m.","cost_status":"purchase_required","under21_safe":true},{"subject_id":"christian-science-plaza-massachusetts-avenue","subject_type":"street_or_district","entity_name":"The First Church of Christ, Scientist","title":"The First Church of Christ, Scientist","subtitle":"Massachusetts Avenue corridor","notes":"Use Massachusetts Avenue to reach the church complex and pair a visit with the nearby Mapparium during its posted hours.","short_summary":"The church at the heart of the Christian Science Plaza.","evidence_claim":"The First Church of Christ, Scientist lists its address at 210 Massachusetts Avenue in Boston.","source_url":"https://www.christianscience.com/about-us/contact-us","source_title":"Contact Us | Christian Science","source_kind":"cultural_institution","source_published_at":null,"source_fetched_at":"2026-08-13","latitude":null,"longitude":null,"maps_url":null,"access_notes":"Worship, tours, and adjacent museum access follow separate posted schedules; check before arrival.","cost_status":"unknown","under21_safe":true},{"subject_id":"pru-center-boylston-street","subject_type":"street_or_district","entity_name":"Prudential Center","title":"Prudential Center","subtitle":"Boylston Street corridor","notes":"Head up Boylston Street to the Prudential Center and use its directory to locate shops, services, and the observatory entrance.","short_summary":"A mixed-use center anchored at 800 Boylston Street.","evidence_claim":"Prudential Center lists its Boston address as 800 Boylston Street.","source_url":"https://www.prudentialcenter.com/contact/","source_title":"Contact | Prudential Center","source_kind":"business_official","source_published_at":null,"source_fetched_at":"2026-08-13","latitude":null,"longitude":null,"maps_url":null,"access_notes":"Individual retailers and attractions maintain their own hours, admission policies, and accessibility information.","cost_status":"unknown","under21_safe":true},{"subject_id":"boston-public-library-boylston-street","subject_type":"street_or_district","entity_name":"Boston Public Library, Central Library","title":"Boston Public Library, Central Library","subtitle":"Boylston Street corridor","notes":"Continue on Boylston Street to the Central Library and check BPL’s calendar for exhibitions, talks, and public programs.","short_summary":"Boston Public Library’s Central Library in Copley Square.","evidence_claim":"Boston Public Library identifies the Central Library at 700 Boylston Street in Copley Square.","source_url":"https://www.bpl.org/locations/central-library/","source_title":"Central Library | Boston Public Library","source_kind":"government","source_published_at":null,"source_fetched_at":"2026-08-13","latitude":null,"longitude":null,"maps_url":null,"access_notes":"Public building access and program schedules may change; consult BPL’s current location information.","cost_status":"not_applicable","under21_safe":true},{"subject_id":"copley-square-boylston-street","subject_type":"street_or_district","entity_name":"Copley Square","title":"Copley Square","subtitle":"Boylston Street corridor","notes":"Pause on the Boylston Street corridor at Copley Square, then use the city page to identify its surrounding landmarks and events.","short_summary":"A City of Boston public square beside Boylston Street.","evidence_claim":"The City of Boston identifies Copley Square as a public park in the Back Bay and notes its location between Boylston Street and Huntington Avenue.","source_url":"https://www.boston.gov/parks/copley-square","source_title":"Copley Square | Boston.gov","source_kind":"government","source_published_at":null,"source_fetched_at":"2026-08-13","latitude":null,"longitude":null,"maps_url":null,"access_notes":"The square is an outdoor public park; conditions and event setups can affect access.","cost_status":"not_applicable","under21_safe":true},{"subject_id":"fenway-park-jersey-street","subject_type":"street_or_district","entity_name":"Fenway Park","title":"Fenway Park","subtitle":"Jersey Street corridor","notes":"Follow the Jersey Street corridor to Fenway Park and use the Red Sox visitor information to check tours or game-day entry rules.","short_summary":"The Red Sox ballpark at 4 Jersey Street.","evidence_claim":"The Boston Red Sox list Fenway Park’s address as 4 Jersey Street, Boston, Massachusetts.","source_url":"https://www.mlb.com/redsox/ballpark/transportation","source_title":"Getting to Fenway Park | Boston Red Sox","source_kind":"business_official","source_published_at":null,"source_fetched_at":"2026-08-13","latitude":null,"longitude":null,"maps_url":null,"access_notes":"Tours and game admission require separate arrangements; review the official Red Sox schedule and ballpark guidance.","cost_status":"purchase_required","under21_safe":true}],"warnings":[]}],"warnings":[]}