{"complete":true,"school_name":"Princeton University","town_name":"Princeton","boards":[{"complete":true,"school_name":"Princeton University","town_name":"Princeton","template_id":"college-late-night-runs","title":"10 Late-Night Runs That Explain Princeton University","description":"Ten under-21-safe food and convenience stops with directly documented evening or overnight availability near campus.","icon":"nightlife","cards":[{"subject_id":"frist-food-gallery-late-dinner","subject_type":"place","entity_name":"Frist Food Gallery","title":"Frist Food Gallery Late Dinner","subtitle":"Frist Campus Center · Monday–Thursday to 10 p.m.","notes":"Use a meal-plan late dinner when regular dining hours have ended; confirm break-period availability before heading to Frist.","short_summary":"Campus late-meal service at the Frist Campus Center.","evidence_claim":"Princeton Campus Dining lists Late Dinner at Frist Gallery Monday through Thursday from 8:30 to 10 p.m.","source_url":"https://dining.princeton.edu/meal-plans/dining-programs/late-meals","source_title":"Late Meal | Princeton Campus Dining","source_kind":"university_official","source_published_at":null,"source_fetched_at":"2026-08-13","latitude":null,"longitude":null,"maps_url":null,"access_notes":"Late Dinner is listed Monday–Thursday, 8:30–10 p.m.; it is for students with a purchased meal plan and is inactive during break periods.","cost_status":"purchase_required","under21_safe":true},{"subject_id":"wawa-152-alexander-street","subject_type":"place","entity_name":"Wawa","title":"Wawa on Alexander Street","subtitle":"152 Alexander St · Open 24 hours","notes":"For a food, drink, or convenience-item stop at any hour, use the store by the Dinky station and Forbes College.","short_summary":"A round-the-clock convenience stop beside campus transit.","evidence_claim":"Princeton Admission identifies the Wawa between the Dinky station and Forbes College as open 24/7.","source_url":"https://admission.princeton.edu/blogs/my-go-spots-late-night-cravings","source_title":"My Go-to Spots for Late Night Cravings | Princeton Admission","source_kind":"university_official","source_published_at":"2024-03-06","source_fetched_at":"2026-08-13","latitude":null,"longitude":null,"maps_url":null,"access_notes":"Princeton Admission states that this Wawa is open 24/7 and locates it between the Dinky station and Forbes College.","cost_status":"purchase_required","under21_safe":true},{"subject_id":"studio-34-butler-college","subject_type":"place","entity_name":"Studio ’34","title":"Studio ’34","subtitle":"Butler College basement · Wednesday–Sunday, 9 p.m.–2 a.m.","notes":"Bring a Princeton ID for the Butler College basement convenience stop; it is a later option only on its listed nights.","short_summary":"An on-campus late-evening convenience store.","evidence_claim":"Princeton Admission lists Studio ’34 in Butler College’s basement as operating Wednesday through Sunday from 9 p.m. to 2 a.m.","source_url":"https://admission.princeton.edu/blogs/my-go-spots-late-night-cravings","source_title":"My Go-to Spots for Late Night Cravings | Princeton Admission","source_kind":"university_official","source_published_at":"2024-03-06","source_fetched_at":"2026-08-13","latitude":null,"longitude":null,"maps_url":null,"access_notes":"The University source lists Wednesday–Sunday hours of 9 p.m.–2 a.m.; confirm access requirements and academic-calendar changes before visiting.","cost_status":"purchase_required","under21_safe":true},{"subject_id":"hoagie-haven","subject_type":"place","entity_name":"Hoagie Haven","title":"Hoagie Haven","subtitle":"242 Nassau St · Open late daily","notes":"Head west on Nassau Street for a made-to-order hoagie; the restaurant’s own mobile site lists weekday and weekend service as “Late.”","short_summary":"A Nassau Street sandwich counter with late service listed daily.","evidence_claim":"Hoagie Haven’s official mobile site lists Monday–Friday and Saturday–Sunday service as continuing “Late.”","source_url":"https://www.hoagiehaven.com/mobile/","source_title":"Hoagie Haven","source_kind":"business_official","source_published_at":null,"source_fetched_at":"2026-08-13","latitude":null,"longitude":null,"maps_url":null,"access_notes":"Official site lists “M-F 8:30AM - Late” and “S-S 9:00AM - Late”; call ahead for a specific closing time.","cost_status":"purchase_required","under21_safe":true},{"subject_id":"tacoria-princeton","subject_type":"place","entity_name":"Tacoria Princeton","title":"Tacoria on Nassau Street","subtitle":"110 Nassau St · Friday–Saturday to 10 p.m.","notes":"Use the Nassau Street location for tacos, burritos, bowls, or vegan menu choices when its Friday or Saturday evening hours fit.","short_summary":"A quick-service Mexican restaurant with weekend 10 p.m. closing.","evidence_claim":"Tacoria lists its Princeton location open until 10 p.m. on Friday and Saturday.","source_url":"https://locations.tacoria.com/locations/nj/princeton/110-nassau-street","source_title":"Tacoria Princeton, NJ","source_kind":"business_official","source_published_at":null,"source_fetched_at":"2026-08-13","latitude":null,"longitude":null,"maps_url":null,"access_notes":"Listed hours are 11:30 a.m.–10 p.m. Friday and Saturday; Sunday–Thursday close at 9 p.m.","cost_status":"purchase_required","under21_safe":true},{"subject_id":"princeton-pizza-star","subject_type":"place","entity_name":"Princeton Pizza Star","title":"Princeton Pizza Star","subtitle":"301 N Harrison St · Daily to 10 p.m.","notes":"Plan a pickup or meal at the North Harrison Street shop when you need a documented 10 p.m. closing option.","short_summary":"A pizza restaurant with daily evening hours to 10 p.m.","evidence_claim":"Princeton Pizza Star’s official site states that it is open daily from 10:30 a.m. to 10 p.m.","source_url":"https://www.princetonpizzastar.com/","source_title":"Princeton Pizza Star | Home Delivery","source_kind":"business_official","source_published_at":null,"source_fetched_at":"2026-08-13","latitude":null,"longitude":null,"maps_url":null,"access_notes":"The official site lists daily hours of 10:30 a.m.–10 p.m.; verify holiday hours before departing.","cost_status":"purchase_required","under21_safe":true},{"subject_id":"alfonsos-pizzeria-princeton","subject_type":"place","entity_name":"Alfonso’s Pizzeria & Restaurant","title":"Alfonso’s Pizzeria & Restaurant","subtitle":"1225 State Rd · Listed to 9:30 p.m.","notes":"Use this State Road pizzeria for a later dinner or pickup, checking the live hours panel on the restaurant’s official site first.","short_summary":"A State Road pizza stop with a listed 9:30 p.m. close.","evidence_claim":"Alfonso’s official website lists its hours as 10 a.m. to 9:30 p.m.","source_url":"https://alfonsospizzaofprinceton.com/","source_title":"Alfonso's Pizzeria & Restaurant - Princeton, NJ","source_kind":"business_official","source_published_at":null,"source_fetched_at":"2026-08-13","latitude":null,"longitude":null,"maps_url":null,"access_notes":"The restaurant’s official site displays hours through 9:30 p.m.; confirm the day’s status before travel.","cost_status":"purchase_required","under21_safe":true},{"subject_id":"prince-tea-house-princeton","subject_type":"place","entity_name":"Prince Tea House Princeton","title":"Prince Tea House","subtitle":"4437 Route 27 · Friday–Saturday to 10 p.m.","notes":"Choose the Route 27 location for tea, desserts, or food on Friday and Saturday evenings; it has different weekday hours.","short_summary":"A tea-house option with 10 p.m. Friday and Saturday availability.","evidence_claim":"Prince Tea House lists its Princeton location open Friday and Saturday from 11 a.m. to 10 p.m.","source_url":"https://www.princeteahouse.com/locations","source_title":"Prince Tea House Locations","source_kind":"business_official","source_published_at":null,"source_fetched_at":"2026-08-13","latitude":null,"longitude":null,"maps_url":null,"access_notes":"Listed Princeton hours are Friday–Saturday 11 a.m.–10 p.m.; Sunday–Thursday close at 9 p.m., and Tuesday is closed.","cost_status":"purchase_required","under21_safe":true},{"subject_id":"mamouns-falafel-princeton","subject_type":"place","entity_name":"Mamoun’s Falafel Princeton","title":"Mamoun’s Falafel","subtitle":"20 Witherspoon St · Daily to 9 p.m.","notes":"For a straightforward evening meal on Witherspoon Street, order before the restaurant’s listed 9 p.m. daily close.","short_summary":"A daily evening falafel and Middle Eastern food option.","evidence_claim":"Mamoun’s official Princeton location page lists daily hours of 11 a.m. to 9 p.m.","source_url":"https://www.mamouns.com/location/mamouns-princeton-nj/","source_title":"Mamoun's Falafel Princeton, NJ","source_kind":"business_official","source_published_at":null,"source_fetched_at":"2026-08-13","latitude":null,"longitude":null,"maps_url":null,"access_notes":"Official hours are 11 a.m.–9 p.m. every day; takeout runs from open until 30 minutes before closing.","cost_status":"purchase_required","under21_safe":true},{"subject_id":"pizza-den-princeton","subject_type":"place","entity_name":"Pizza Den Princeton","title":"Pizza Den","subtitle":"242½ Nassau St · Friday–Saturday to 9:30 p.m.","notes":"Use the storefront beside Hoagie Haven for pizza or sliders on Friday or Saturday, when its official hours extend to 9:30 p.m.","short_summary":"A Nassau Street pizza spot with later Friday and Saturday hours.","evidence_claim":"Pizza Den lists Friday and Saturday hours of 11 a.m. to 9:30 p.m.","source_url":"https://www.pizzadenprinceton.com/","source_title":"Pizza Den Princeton","source_kind":"business_official","source_published_at":null,"source_fetched_at":"2026-08-13","latitude":null,"longitude":null,"maps_url":null,"access_notes":"Official hours list Friday–Saturday 11 a.m.–9:30 p.m.; Monday–Thursday close at 9 p.m. and Sunday is closed.","cost_status":"purchase_required","under21_safe":true}],"warnings":[]}],"warnings":[]}