{"complete":true,"school_name":"University of Mary Washington","town_name":"Fredericksburg","boards":[{"complete":true,"school_name":"University of Mary Washington","town_name":"Fredericksburg","template_id":"college-late-night-runs","title":"10 Late-Night Runs That Explain University of Mary Washington","description":"Ten Fredericksburg food destinations with currently published evening hours; check the linked business page before heading out.","icon":"nightlife","cards":[{"subject_id":"dennys-5325-jefferson-davis-highway","subject_type":"place","entity_name":"Denny's","title":"Denny's","subtitle":"5325 Jefferson Davis Highway","notes":"Use the location page to confirm service and order options, then plan a breakfast, pickup, or delivery stop at any hour.","short_summary":"A nearly round-the-clock option for breakfast and diner food.","evidence_claim":"Denny's lists this Fredericksburg location as open from 12 AM to 11:58 PM every day and describes it as serving breakfast 24/7.","source_url":"https://dennys.com/location/denny-s-9575-720722","source_title":"Denny's Fredericksburg location","source_kind":"business_official","source_published_at":null,"source_fetched_at":"2026-08-13","latitude":null,"longitude":null,"maps_url":null,"access_notes":"Official location page lists daily store hours of 12 AM–11:58 PM; pickup and delivery are offered.","cost_status":"purchase_required","under21_safe":true},{"subject_id":"hashtag-gyro-and-subs","subject_type":"place","entity_name":"Hashtag Gyro And Subs","title":"Hashtag Gyro And Subs","subtitle":"11330 Patriot Highway","notes":"Check the restaurant’s ordering options and posted hours, then use the carryout or delivery window for a late food run.","short_summary":"A casual gyro, sub, burger, and fried-chicken restaurant open through midnight.","evidence_claim":"Hashtag Gyro And Subs lists its Fredericksburg restaurant, carryout, and delivery hours as ending at midnight daily.","source_url":"https://www.hashtaggyronsubs.com/","source_title":"Hashtag Gyro And Subs","source_kind":"business_official","source_published_at":null,"source_fetched_at":"2026-08-13","latitude":null,"longitude":null,"maps_url":null,"access_notes":"Official site lists restaurant, carryout, and delivery service through midnight every day.","cost_status":"purchase_required","under21_safe":true},{"subject_id":"el-ultimo-trago","subject_type":"place","entity_name":"El Ultimo Trago","title":"El Ultimo Trago","subtitle":"9969 Patriot Highway","notes":"Use the restaurant’s location page to confirm the day’s closing time, then plan a dine-in or food-focused group meal.","short_summary":"A Mexican restaurant with a posted midnight Saturday closing time.","evidence_claim":"El Ultimo Trago lists Fredericksburg hours until 10 PM Sunday–Wednesday, 11 PM Thursday–Friday, and midnight Saturday.","source_url":"https://elultimotrago.net/","source_title":"El Ultimo Trago","source_kind":"business_official","source_published_at":null,"source_fetched_at":"2026-08-13","latitude":null,"longitude":null,"maps_url":null,"access_notes":"Official site posts closing at 10 PM Sun–Wed, 11 PM Thu–Fri, and midnight Sat.","cost_status":"purchase_required","under21_safe":true},{"subject_id":"legends-grille","subject_type":"place","entity_name":"Legends Grille","title":"Legends Grille","subtitle":"10500 Spotsylvania Avenue","notes":"Check the day’s posted closing time and use the restaurant’s ordering link if a pickup plan works better than dining in.","short_summary":"A family-friendly American restaurant with late weekday and weekend hours.","evidence_claim":"Legends Grille identifies itself as family-friendly and lists hours until 11 PM Monday–Thursday and midnight Friday–Saturday.","source_url":"https://legendsgrilleva.com/","source_title":"Legends Grille","source_kind":"business_official","source_published_at":null,"source_fetched_at":"2026-08-13","latitude":null,"longitude":null,"maps_url":null,"access_notes":"Official site lists 11 AM–11 PM Mon–Thu, 11 AM–midnight Fri–Sat, and 11 AM–10 PM Sun.","cost_status":"purchase_required","under21_safe":true},{"subject_id":"chick-fil-a-fredericksburg-plank-road","subject_type":"place","entity_name":"Chick-fil-A Fredericksburg","title":"Chick-fil-A Fredericksburg","subtitle":"4220 Plank Road","notes":"Confirm the current operating day first, then choose dine-in, carry-out, drive-thru, or delivery before the 10 PM close.","short_summary":"A quick-service option with multiple official service modes through 10 PM.","evidence_claim":"Chick-fil-A lists its 4220 Plank Road location’s dine-in, carry-out, drive-thru, and delivery hours as 6 AM–10 PM Monday–Saturday.","source_url":"https://www.chick-fil-a.com/locations/va/fredericksburg","source_title":"Chick-fil-A Fredericksburg","source_kind":"business_official","source_published_at":null,"source_fetched_at":"2026-08-13","latitude":null,"longitude":null,"maps_url":null,"access_notes":"Official location page lists all service modes until 10 PM Mon–Sat; the restaurant is closed Sunday.","cost_status":"purchase_required","under21_safe":true},{"subject_id":"texas-roadhouse-fredericksburg","subject_type":"place","entity_name":"Texas Roadhouse Fredericksburg","title":"Texas Roadhouse Fredericksburg","subtitle":"3940 Plank Road, Suite A","notes":"Use the restaurant’s waitlist or to-go option and confirm the day’s hours before making a later dinner plan.","short_summary":"A full-service dinner stop open until 11 PM on Fridays and Saturdays.","evidence_claim":"Texas Roadhouse lists its Fredericksburg location open until 11 PM on Friday and Saturday, and until 10 PM Sunday–Thursday.","source_url":"https://www.texasroadhouse.com/locations/464-fredericksburgva","source_title":"Texas Roadhouse Fredericksburg","source_kind":"business_official","source_published_at":null,"source_fetched_at":"2026-08-13","latitude":null,"longitude":null,"maps_url":null,"access_notes":"Official location page lists 11 PM closes Fri–Sat and 10 PM closes Sun–Thu.","cost_status":"purchase_required","under21_safe":true},{"subject_id":"castiglias-italian-restaurant","subject_type":"place","entity_name":"Castiglia's Italian Restaurant","title":"Castiglia's Italian Restaurant","subtitle":"324 William Street","notes":"Check the dinner window before setting out, and use the restaurant’s stated take-out option if you need a shorter stop.","short_summary":"Downtown Italian dining with an 11 PM Friday and Saturday close.","evidence_claim":"Castiglia's lists hours until 10 PM Monday–Thursday and until 11 PM Friday and Saturday, with take-out available.","source_url":"https://www.castigliasitalianrestaurant.com/","source_title":"Castiglia's Italian Restaurant","source_kind":"business_official","source_published_at":null,"source_fetched_at":"2026-08-13","latitude":null,"longitude":null,"maps_url":null,"access_notes":"Official site lists closing at 10 PM Mon–Thu and 11 PM Fri–Sat; Sunday closes at 9 PM.","cost_status":"purchase_required","under21_safe":true},{"subject_id":"mi-rancho-fredericksburg","subject_type":"place","entity_name":"Mi Rancho Mexican Restaurant","title":"Mi Rancho Mexican Restaurant","subtitle":"3400 Plank Road","notes":"Confirm whether it is a Friday or Saturday, then choose dine-in, takeout, or the restaurant’s listed reservation option.","short_summary":"A Mexican restaurant open until 11 PM on Friday and Saturday.","evidence_claim":"Mi Rancho lists its Fredericksburg location as open until 10 PM Sunday–Thursday and until 11 PM Friday and Saturday.","source_url":"https://www.miranchoonline.com/","source_title":"Mi Rancho Mexican Restaurant","source_kind":"business_official","source_published_at":null,"source_fetched_at":"2026-08-13","latitude":null,"longitude":null,"maps_url":null,"access_notes":"Official site posts 10:30 AM–10 PM Sun–Thu and 10:30 AM–11 PM Fri–Sat for the Fredericksburg location.","cost_status":"purchase_required","under21_safe":true},{"subject_id":"fahrenheit-132","subject_type":"place","entity_name":"Fahrenheit 132","title":"Fahrenheit 132","subtitle":"318 William Street","notes":"Reserve or confirm the evening schedule before leaving, especially for a Friday or Saturday dinner that runs to 11 PM.","short_summary":"A downtown restaurant with later Friday and Saturday dinner hours.","evidence_claim":"Fahrenheit 132 lists hours of 4–10 PM Sunday–Thursday and 4–11 PM Friday–Saturday at 318 William Street.","source_url":"https://www.fahrenheit132.com/contact-us/","source_title":"Fahrenheit 132 contact and hours","source_kind":"business_official","source_published_at":null,"source_fetched_at":"2026-08-13","latitude":null,"longitude":null,"maps_url":null,"access_notes":"Official restaurant page lists 4–11 PM Friday–Saturday and 4–10 PM Sunday–Thursday.","cost_status":"purchase_required","under21_safe":true},{"subject_id":"vocelli-pizza-fredericksburg","subject_type":"place","entity_name":"Vocelli Pizza Fredericksburg","title":"Vocelli Pizza Fredericksburg","subtitle":"7008 Salem Fields Boulevard","notes":"Check the official ordering page for the current day’s close, then place a pickup or delivery order before the listed 11 PM end time.","short_summary":"A pizza option with a published 11 PM closing time.","evidence_claim":"Vocelli Pizza’s Fredericksburg site lists the 7008 Salem Fields Boulevard restaurant as open from 10 AM to 11 PM.","source_url":"https://fredvocellipizza.com/","source_title":"Vocelli Pizza Fredericksburg","source_kind":"business_official","source_published_at":null,"source_fetched_at":"2026-08-13","latitude":null,"longitude":null,"maps_url":null,"access_notes":"Official location site lists an 11 PM close; confirm the current day’s availability when ordering.","cost_status":"purchase_required","under21_safe":true}],"warnings":[]}],"warnings":[]}